{"$schema":"https://memory-os.example/schemas/memory-town/linear-feature-graph.v1.schema.json","graphDocumentId":"memory-town.linear.round7.valid","graphDocumentVersion":1,"mapId":"memory-town.map.prototype.round7","layoutRevision":7,"nodes":[{"nodeId":"node.river.source","districtInstanceId":"district.central.main","position":{"cellX":1,"cellY":0,"elevationLevel":0},"nodeKind":"source"},{"nodeId":"node.river.crossing","districtInstanceId":"district.central.main","position":{"cellX":2,"cellY":3,"elevationLevel":0},"nodeKind":"crossing"},{"nodeId":"node.river.outlet","districtInstanceId":"district.coast.main","position":{"cellX":3,"cellY":8,"elevationLevel":0},"nodeKind":"outlet"},{"nodeId":"node.road.west","districtInstanceId":"district.central.main","position":{"cellX":0,"cellY":3,"elevationLevel":0},"nodeKind":"endpoint"},{"nodeId":"node.road.crossing","districtInstanceId":"district.central.main","position":{"cellX":2,"cellY":3,"elevationLevel":0},"nodeKind":"crossing"},{"nodeId":"node.road.harbor","districtInstanceId":"district.coast.main","position":{"cellX":5,"cellY":6,"elevationLevel":0},"nodeKind":"endpoint"}],"segments":[{"segmentId":"segment.river.upper","fromNodeId":"node.river.source","toNodeId":"node.river.crossing","controlPoints":[{"cellX":1,"cellY":1,"elevationLevel":0},{"cellX":2,"cellY":2,"elevationLevel":0}],"widthProfileId":"width.river.small","styleProfileId":"water.style.clear-stream"},{"segmentId":"segment.river.lower","fromNodeId":"node.river.crossing","toNodeId":"node.river.outlet","controlPoints":[{"cellX":2,"cellY":4,"elevationLevel":0},{"cellX":2,"cellY":5,"elevationLevel":0},{"cellX":3,"cellY":6,"elevationLevel":0},{"cellX":3,"cellY":7,"elevationLevel":0}],"widthProfileId":"width.river.medium","styleProfileId":"water.style.clear-river"},{"segmentId":"segment.road.west-crossing","fromNodeId":"node.road.west","toNodeId":"node.road.crossing","controlPoints":[{"cellX":1,"cellY":3,"elevationLevel":0}],"widthProfileId":"width.road.standard","styleProfileId":"path.style.warm-stone"},{"segmentId":"segment.road.crossing-harbor","fromNodeId":"node.road.crossing","toNodeId":"node.road.harbor","controlPoints":[{"cellX":3,"cellY":4,"elevationLevel":0},{"cellX":4,"cellY":5,"elevationLevel":0}],"widthProfileId":"width.road.standard","styleProfileId":"path.style.warm-stone"}],"waterFeatures":[{"waterFeatureId":"water.river.main","kind":"river","segmentIds":["segment.river.upper","segment.river.lower"],"sourceNodeId":"node.river.source","outletNodeId":"node.river.outlet","widthProfileId":"width.river.mixed","styleProfileId":"water.style.clear-river","flowDirection":180,"editablePhase":"reshape_later","districtSocketIds":["socket.central.river.south","socket.coast.river.north"]}],"pathFeatures":[{"pathFeatureId":"path.main.harbor","kind":"road","segmentIds":["segment.road.west-crossing","segment.road.crossing-harbor"],"surfaceProfileId":"path.style.warm-stone","accessibilityProfileId":"access.step-free-primary","districtSocketIds":["socket.central.road.south","socket.coast.road.north"]}]}
